{
  "name": "origins.neoorigins.classic.class_cook.name",
  "description": "origins.neoorigins.classic.class_cook.description",
  "icon": "minecraft:bread",
  "impact": "none",
  "order": 15,
  "powers": [
    "neoorigins:class_cook_food",
    "neoorigins:class_cook_smoker_xp"
  ],
  "upgrades": []
}
