{
  "name": "origins.neoorigins.class_explorer.name",
  "description": "origins.neoorigins.class_explorer.description",
  "icon": "minecraft:compass",
  "impact": "none",
  "order": 5,
  "powers": [
    "neoorigins:class_explorer_kit",
    "neoorigins:class_explorer_clock",
    "neoorigins:class_explorer_maps",
    "neoorigins:class_explorer_stamina",
    "neoorigins:class_explorer_sure_footed",
    "neoorigins:class_explorer_climbers_step",
    "neoorigins:step_assist_toggle",
    "neoorigins:step_assist_switch",
    "neoorigins:class_explorer_campfire_rest"
  ],
  "upgrades": []
}
