{
  "name": "origins.neoorigins.classic.class_warrior.name",
  "description": "origins.neoorigins.classic.class_warrior.description",
  "icon": "minecraft:iron_sword",
  "impact": "none",
  "order": 1,
  "powers": [
    "neoorigins:class_warrior_damage",
    "neoorigins:classic_warrior_shield_wield"
  ],
  "upgrades": []
}
