{
  "name": "origins.neoorigins.class_cook.name",
  "description": "origins.neoorigins.class_cook.description",
  "icon": "minecraft:bread",
  "impact": "none",
  "order": 15,
  "powers": [
    "neoorigins:class_cook_food",
    "neoorigins:class_cook_smoker_xp",
    "neoorigins:class_cook_iron_stomach",
    "neoorigins:class_cook_seasoned_palate",
    "neoorigins:class_cook_knife"
  ],
  "upgrades": []
}
