{
  "name": "origins.neoorigins.classic.class_beastmaster.name",
  "description": "origins.neoorigins.classic.class_beastmaster.description",
  "icon": "minecraft:lead",
  "impact": "none",
  "order": 4,
  "powers": [
    "neoorigins:classic_beastmaster_fauna_friends",
    "neoorigins:class_beastmaster_diffusal"
  ],
  "upgrades": []
}
